question,choices,answer
"An organization decided to raise Rs. 6 lakh by collecting equal contribution from each of its employees. If each of them had contributed Rs. 60 extra, the contribution would have been Rs. 6.24 lakh. How many employees are there in that organization?","['300', '200', '400', '100', '500']",C
"Jerry purchased a 1-year $5,000 bond that paid an annual interest rate of 12% compounded every six months. How much interest had this bond accrued at maturity?","['$5102', '$618', '$216', '$202', '$200']",B
"Christopher and Jonathan were having bets. They decide that a coin will be flipped twenty times and each time it turns heads, Christopher will give $2 to Jonathan and each time it turns out to be Tails, Jonathan will give 3$ to Christopher. After flipping for twenty times none of the both won or lost any amount.
How many times did the coin landed on Heads ?","['10', '23', '16', '18', '12']",E
"A man borrows Rs.360 If he pays it back in 12 monthly installments of Rs.31.50, what is his interest rate?","['1.5%', '4.5%', '10%', '5%', '12%']",D
"The average weight of 10 oarsmen in a boat is increased by 1.8 kg when one of the crew, who weighs 53 kg is replaced by a new man. Find the weight of the new man.","['71', '62', '43', '67', '40']",A
A train M leaves City A at 5 am and reaches City B at 9am. Another train N leaves City B at 7am and reaches City A at 1030am. At what time do the 2 trains cross one another?,"['1 hr 23 min', '1 hr 15 min', '1 hr 8 min', '56 min', '55 min']",D
"In a large forest, 300 deer were caught, tagged, and returned during 2001. During 2002, 500 deer were caught at random, of which only 20 had tags from the previous year. If the percent of deer in the forest that had tags during the second year and were caught in the 500 deer sample is representative of the percent of the total deer population in the forest with tags, what is the total deer population in the forest (assuming no change in population between 2001 and 2002)?","['300', '500', '5000', '6000', '7500']",E
"A car finishes a journey in 20 hours at the speed of 60 km/hr. If the same distance is to be covered in 10 hours, how much speed does the car gain?","['80 kmph', '50 kmph', '120 kmph', '70 kmph', '80 kmph']",C
Mr.Sam takes 17 hours to go by train to a certain city and return by car. He loses 4 hours if he goes both ways by train. How long would he have taken if he had traveled by car in both ways?,"['22 hrs', '18 hrs', '16 hrs', '20 hrs', '13 hrs']",E
"A sporting goods store carries only yellow and white golf balls. At the beginning of the day it had 600 golf balls in stock, and by the end of the day it had sold 80% of its inventory of golf balls. If the store sold an equal number of yellow and white golf balls, and in doing so sold all of its white golf balls, how many yellow golf balls did the store have to begin the day?","['80', '120', '240', '320', '360']",E
"Decipher the following multiplication table:
M A D
B E
-------------
M A D
R A E
-------------
A M I D","['9 2 0 0', '9 2 0 9', '9 2 0 1', '9 2 0 7', '9 2 2 2']",D
"Joe's age, Joe's sister's age and Joe’s fathers age sums up to 100. When Joe is as old as his father, Joe's sister will be twice as old as now. When Joe is as old as his father then his father is twice as old as when his sister was as old as her father. Find the age of Joe's father?","['45', '48', '50', '55', '58']",C
[5 + ? × 19 - 15 - 7]/[13 × 13 - 156] = 6,"['4', '4.5', '5', '5.5', '6.5']",C
"Exactly 2/5th of the children in a certain class are girls. If there are 100 boys in the class, how many girls are in the class?","['50', '100', '150', '200', '70']",C
"If 75 percent of the employees of a certain company take a winter vacation, 40 percent take a winter and a summer vacation, and 20 percent take neither a winter nor a summer vacation, what Q percent of the employees take a summer vacation but not a winter vacation?","['5%', '15%', '25%', '35%', '45%']",A
"If 6x - y = 24 and y = 3x, what is the value of x?","['8', '9', '10', '11', '12']",A
A pen company produces very fine quality of writing pens. Company knows that on average 10% of the produced pens are always defective so are rejected before packing. Company promises to deliver 7200 pens to its wholesaler at Rs. 10 each. It estimates the overall profit on all the manufactured pens to be 25%. What is the manufactured cost of each pen?,"['Rs. 6', 'Rs. 7.2', 'Rs. 5.6', 'Rs. 8', 'None of these']",B
